{
  "schema_version": "1.0.0",
  "opportunity_id": "scholarship_for_students_with_disabiliti",
  "name": "Scholarship For Students With Disabilities\n1",
  "category": "vocational_training",
  "provider": "Government of India",
  "description": "DEPwD - POST-MATRIC SCHOLARSHIP FOR STUDENTS WITH DISABILITIES 1. Eligibility: - Minimum 40% disability with valid UDID / Medical certificate. - Enrolled in Class XI, XII or recognized diploma/degree courses. - Parental income not exceeding Rs. 2,50,000/- per annum. 2. Rates of Scholarship: - Maintenance allowance starting from Rs. 4,000/- p.a. for Class XI and XII day-scholars. - Book grant of Rs",
  "education_levels": [
    "diploma"
  ],
  "geographic_scope": {
    "type": "national",
    "states": [],
    "districts": []
  },
  "eligibility_criteria": [
    {
      "criterion_id": "crit_income",
      "field": "annual_family_income",
      "operator": "less_than_or_equal",
      "value": 250000.0,
      "unit": "INR/year",
      "condition_type": "mandatory",
      "required": true,
      "evidence_reference": "ev_income_1",
      "review_status": "unreviewed",
      "notes": "Auto-detected from excerpt: 'Parental income not exceeding Rs. 2,50,000'"
    }
  ],
  "required_documents": [
    {
      "document_name": "Aadhaar Card",
      "document_type": "identity_proof",
      "mandatory": true,
      "description": "Required for student identification and direct bank transfer.",
      "evidence_reference": null
    }
  ],
  "benefits": {
    "type": "financial",
    "financial_amount": null,
    "currency": "INR",
    "frequency": "annual",
    "description": "Assistance provided under Scholarship For Students With Disabilities\n1",
    "non_financial_benefits": []
  },
  "application_period": {
    "opening_date": null,
    "deadline": null,
    "academic_year": null,
    "status": "unknown",
    "status_verification_date": "2026-10-16",
    "notes": "Extracted via rule-based fallback. Requires human review."
  },
  "application_status": "unknown",
  "official_source_urls": [
    "https://scholarships.gov.in/"
  ],
  "application_url": "https://scholarships.gov.in/",
  "evidence": [
    {
      "evidence_id": "ev_income_1",
      "field_path": "eligibility_criteria[0].value",
      "source_url": "https://scholarships.gov.in/",
      "source_title": "Post-Matric Scholarship for Students with Disabilities Guidelines",
      "supporting_excerpt": "Parental income not exceeding Rs. 2,50,000",
      "retrieved_at": "2026-10-16T05:37:35.682293+00:00",
      "extraction_method": "rule_based",
      "review_status": "pending_review"
    }
  ],
  "last_checked_at": "2026-10-16T05:37:35.682293+00:00",
  "verification_status": "draft",
  "review_notes": [
    "Created via rule-based fallback extractor. Pending human verification."
  ],
  "synthetic": false
}