{
  "schema_version": "1.0.0",
  "opportunity_id": "yojana_pmkvy_4",
  "name": "Yojana (Pmkvy 4",
  "category": "vocational_training",
  "provider": "Government of India",
  "description": "SKILL INDIA DIGITAL HUB - PRADHAN MANTRI KAUSHAL VIKAS YOJANA (PMKVY 4.0) 1. Objective: Encourage skill development among youth to take up industry-relevant skill training for better livelihoods. 2. Target Beneficiaries: Indian nationals between 15-45 years of age; school/college dropouts or unemployed rural youth. 3. Training Duration: Short-term training ranging between 200 to 600 hours dependin",
  "education_levels": [
    "class_9",
    "class_10"
  ],
  "geographic_scope": {
    "type": "national",
    "states": [],
    "districts": []
  },
  "eligibility_criteria": [],
  "required_documents": [
    {
      "document_name": "Aadhaar Card",
      "document_type": "identity_proof",
      "mandatory": true,
      "description": "Required for student identification and direct bank transfer.",
      "evidence_reference": null
    }
  ],
  "benefits": {
    "type": "financial",
    "financial_amount": null,
    "currency": "INR",
    "frequency": "annual",
    "description": "Assistance provided under Yojana (Pmkvy 4",
    "non_financial_benefits": []
  },
  "application_period": {
    "opening_date": null,
    "deadline": null,
    "academic_year": null,
    "status": "unknown",
    "status_verification_date": "2026-10-16",
    "notes": "Extracted via rule-based fallback. Requires human review."
  },
  "application_status": "unknown",
  "official_source_urls": [
    "https://www.skillindiadigital.gov.in/"
  ],
  "application_url": "https://www.skillindiadigital.gov.in/",
  "evidence": [],
  "last_checked_at": "2026-10-16T05:37:35.684039+00:00",
  "verification_status": "needs_review",
  "review_notes": [
    "Created via rule-based fallback extractor. Pending human verification.",
    "Placed into review queue on 2026-10-16T05:40:18.972355+00:00"
  ],
  "synthetic": false
}