{
  "schema_version": "1.0.0",
  "opportunity_id": "opp_naps_apprenticeship_2026",
  "name": "National Apprenticeship Promotion Scheme (NAPS-2)",
  "category": "apprenticeship",
  "provider": "Ministry of Skill Development and Entrepreneurship",
  "description": "Government scheme promoting apprenticeship training across industries, co-funding monthly stipends to students who passed Class 10, Class 12, or ITI.",
  "education_levels": [
    "class_10",
    "class_12",
    "vocational",
    "diploma"
  ],
  "geographic_scope": {
    "type": "national",
    "states": [],
    "districts": []
  },
  "eligibility_criteria": [
    {
      "criterion_id": "crit_naps_age",
      "field": "age_years",
      "operator": "greater_than_or_equal",
      "value": 14.0,
      "unit": "years",
      "condition_type": "mandatory",
      "required": true,
      "evidence_reference": "ev_naps_age",
      "review_status": "confirmed",
      "notes": "Minimum age is 14 years."
    },
    {
      "criterion_id": "crit_naps_qual",
      "field": "minimum_academic_qualification",
      "operator": "in",
      "value": [
        "class_10_pass",
        "class_12_pass",
        "iti_pass"
      ],
      "unit": null,
      "condition_type": "mandatory",
      "required": true,
      "evidence_reference": "ev_naps_qual",
      "review_status": "confirmed",
      "notes": "Minimum educational qualification prescribed for designated or optional trade."
    }
  ],
  "required_documents": [
    {
      "document_name": "Class 10 / ITI Certificate",
      "document_type": "academic_proof",
      "mandatory": true,
      "description": "Educational qualification proof.",
      "evidence_reference": "ev_naps_qual"
    },
    {
      "document_name": "Aadhaar Card",
      "document_type": "identity_proof",
      "mandatory": true,
      "description": "For e-KYC and DBT stipend.",
      "evidence_reference": "ev_naps_age"
    },
    {
      "document_name": "Bank Account Details",
      "document_type": "bank_details",
      "mandatory": true,
      "description": "Aadhaar-seeded bank account.",
      "evidence_reference": "ev_naps_stipend"
    }
  ],
  "benefits": {
    "type": "financial",
    "financial_amount": 1500.0,
    "currency": "INR",
    "frequency": "monthly",
    "description": "Government co-funds 25% of stipend up to Rs. 1,500/- per month via DBT; full employer stipend typically Rs. 7,000 - 10,000/month plus on-the-job industrial experience.",
    "non_financial_benefits": [
      "Government National Certification",
      "Direct Bank Transfer (DBT)"
    ]
  },
  "application_period": {
    "opening_date": "2025-07-01",
    "deadline": null,
    "academic_year": "2025-2026",
    "status": "open",
    "status_verification_date": "2026-10-16",
    "notes": "Verified against official guidelines. Window status: open."
  },
  "application_status": "open",
  "official_source_urls": [
    "https://www.apprenticeshipindia.gov.in/",
    "https://www.msde.gov.in/en/schemes-initiatives/schemes-programmes-under-msde/naps"
  ],
  "application_url": "https://www.apprenticeshipindia.gov.in/",
  "evidence": [
    {
      "evidence_id": "ev_naps_age",
      "field_path": "eligibility_criteria[0].value",
      "supporting_excerpt": "Candidate must have completed at least 14 years of age",
      "retrieved_at": "2026-10-16T05:37:35.670072+00:00",
      "extraction_method": "manual",
      "review_status": "verified",
      "source_url": "https://www.msde.gov.in/en/schemes-initiatives/schemes-programmes-under-msde/naps",
      "source_title": "NAPS-2 Scheme Guidelines - MSDE"
    },
    {
      "evidence_id": "ev_naps_qual",
      "field_path": "eligibility_criteria[1].value",
      "supporting_excerpt": "Must possess minimum educational qualification as prescribed for the trade (Class 5, Class 8, Class 10, or Class 12).",
      "retrieved_at": "2026-10-16T05:37:35.670072+00:00",
      "extraction_method": "manual",
      "review_status": "verified",
      "source_url": "https://www.msde.gov.in/en/schemes-initiatives/schemes-programmes-under-msde/naps",
      "source_title": "NAPS-2 Scheme Guidelines - MSDE"
    },
    {
      "evidence_id": "ev_naps_stipend",
      "field_path": "benefits.financial_amount",
      "supporting_excerpt": "The Government directly co-funds 25% of prescribed stipend up to Rs. 1,500/- per month per apprentice directly to the apprentice's bank account via DBT.",
      "retrieved_at": "2026-10-16T05:37:35.670072+00:00",
      "extraction_method": "manual",
      "review_status": "verified",
      "source_url": "https://www.msde.gov.in/en/schemes-initiatives/schemes-programmes-under-msde/naps",
      "source_title": "NAPS-2 Scheme Guidelines - MSDE"
    }
  ],
  "last_checked_at": "2026-10-16T05:37:35.670072+00:00",
  "verification_status": "verified",
  "review_notes": [
    "[2026-10-16T05:37:35.670072+00:00] Verified by Human Data-Quality Engineer: Exact excerpts confirmed from official Ministry of Skill Development and Entrepreneurship guidelines.",
    "All mandatory criteria and benefit amounts cross-referenced with official NSP/Ministry documentation."
  ],
  "synthetic": false
}